article_link,date_time,article_title
https://news.detik.com/berita/d-7016190/iha-siap-kirim-bantuan-ke-gaza-tunggu-lampu-hijau-dari-kemlu,02 Nov 2023 18:44 WIB,"IHA Siap Kirim Bantuan ke Gaza, Tunggu Lampu Hijau dari Kemlu"
https://news.detik.com/internasional/d-7016104/menhan-menkeu-israel-cekcok-soal-pendapatan-pajak-otoritas-palestina,02 Nov 2023 17:59 WIB,Menhan-Menkeu Israel Cekcok Soal Pendapatan Pajak Otoritas Palestina
https://finance.detik.com/berita-ekonomi-bisnis/d-7015982/tembus-rp-226-miliar-ini-produk-israel-yang-diimpor-ri,02 Nov 2023 17:22 WIB,"Tembus Rp 226 Miliar, Ini Produk Israel yang Diimpor RI"
https://inet.detik.com/detiktv/d-7015951/ramai-netizen-pakai-emoji-semangka-simbol-dukungan-untuk-palestina,02 Nov 2023 17:12 WIB,"Ramai Netizen Pakai Emoji Semangka, Simbol Dukungan untuk Palestina"
https://www.detik.com/hikmah/khazanah/d-7015907/negara-negara-islam-diminta-setop-ekspor-minyak-makanan-ke-israel,02 Nov 2023 17:00 WIB,Negara-negara Islam Diminta Setop Ekspor Minyak-Makanan ke Israel
https://finance.detik.com/berita-ekonomi-bisnis/d-7015914/2-aplikasi-china-hapus-israel-dan-palestina-dari-peta-digital,02 Nov 2023 16:59 WIB,2 Aplikasi China Hapus Israel dan Palestina dari Peta Digital
https://www.detik.com/hikmah/khazanah/d-7015684/indonesian-humanitarian-alliance-kecam-serangan-israel-ke-gaza,02 Nov 2023 16:15 WIB,Indonesian Humanitarian Alliance Kecam Serangan Israel ke Gaza
https://www.detik.com/hikmah/khazanah/d-7015744/6-6-ton-bantuan-dari-indonesia-akan-segera-disalurkan-ke-gaza-sabtu-besok,02 Nov 2023 15:50 WIB,"6,6 Ton Bantuan dari Indonesia Akan Segera Disalurkan ke Gaza Sabtu Besok"
https://www.detik.com/hikmah/khazanah/d-7015696/dorong-kepedulian-indonesia-terhadap-palestina-iha-siap-kirimkan-bantuan,02 Nov 2023 15:26 WIB,"Dorong Kepedulian Indonesia Terhadap Palestina, IHA Siap Kirimkan Bantuan"
https://news.detik.com/internasional/d-7015650/siapa-itu-houthi-di-yaman-yang-ikut-serang-israel,02 Nov 2023 15:03 WIB,Siapa Itu Houthi di Yaman yang Ikut Serang Israel?
https://news.detik.com/internasional/d-7015619/profil-craig-mokhiber-direktur-ham-pbb-mundur-terkait-palestina,02 Nov 2023 14:51 WIB,"Profil Craig Mokhiber, Direktur HAM PBB Mundur terkait Palestina"
https://www.detik.com/hikmah/khazanah/d-7015586/ulama-dunia-desak-negara-arab-islam-jihad-bantu-palestina,02 Nov 2023 14:43 WIB,Ulama Dunia Desak Negara Arab-Islam Jihad Bantu Palestina
https://inet.detik.com/detiktv/d-7015511/foto-satelit-sebelum-dan-setelah-kamp-pengungsi-gaza-dibom-israel,02 Nov 2023 14:22 WIB,Foto Satelit Sebelum dan Setelah Kamp Pengungsi Gaza Dibom Israel
https://travel.detik.com/travel-news/d-7015048/tentang-gambar-semangka-untuk-bela-palestina,02 Nov 2023 14:05 WIB,Tentang Gambar Semangka untuk Bela Palestina
https://hot.detik.com/detiktv/d-7015464/angelina-jolie-soal-palestina-israel-keluarga-dibunuh-dunia-hanya-menyaksikan,02 Nov 2023 13:58 WIB,"Angelina Jolie soal Palestina-Israel: Keluarga Dibunuh, Dunia Hanya Menyaksikan"
https://health.detik.com/berita-detikhealth/d-7015409/dokter-rs-indonesia-gaza-histeris-dapati-putrinya-jadi-korban-serangan-israel,02 Nov 2023 13:29 WIB,Dokter RS Indonesia Gaza Histeris Dapati Putrinya Jadi Korban Serangan Israel
https://news.detik.com/berita/d-7015403/dukung-palestina-jk-imbau-umat-islam-qunut-nazilah-saat-salat-jumat-besok,02 Nov 2023 13:25 WIB,"Dukung Palestina, JK Imbau Umat Islam Qunut Nazilah Saat Salat Jumat Besok"
https://hot.detik.com/celeb/d-7015402/mario-lawalata-klarifikasi-like-postingan-gal-gadot-gue-support-humanity,02 Nov 2023 13:25 WIB,Mario Lawalata Klarifikasi Like Postingan Gal Gadot: Gue Support Humanity
https://news.detik.com/berita/d-7015341/tni-siapkan-2-pesawat-hercules-angkut-bantuan-untuk-palestina,02 Nov 2023 12:52 WIB,TNI Siapkan 2 Pesawat Hercules Angkut Bantuan untuk Palestina
https://hot.detik.com/tv-news/d-7015255/upin-dan-ipin-ikut-berdoa-untuk-palestina,02 Nov 2023 12:49 WIB,Upin dan Ipin Ikut Berdoa untuk Palestina
https://news.detik.com/detiktv/d-7015272/rafah-akhirnya-dibuka-wna-korban-luka-dievakuasi-dari-gaza,02 Nov 2023 12:21 WIB,"Rafah Akhirnya Dibuka, WNA-Korban Luka Dievakuasi dari Gaza"
https://www.detik.com/sumut/berita/d-7015159/raline-shah-saya-support-palestina-sejak-lahir,02 Nov 2023 12:10 WIB,Raline Shah: Saya Support Palestina Sejak Lahir
https://finance.detik.com/berita-ekonomi-bisnis/d-7015241/israel-punya-produk-mendunia-tapi-tanamnya-di-tanah-palestina,02 Nov 2023 12:06 WIB,"Israel Punya Produk Mendunia, tapi Tanamnya di Tanah Palestina"
https://news.detik.com/foto-news/d-7014981/18-ribu-ton-bom-telah-dijatuhkan-ke-gaza-lebih-dahsyat-dari-hiroshima,02 Nov 2023 11:31 WIB,"18 Ribu Ton Bom Telah Dijatuhkan ke Gaza, Lebih Dahsyat dari Hiroshima"
https://news.detik.com/internasional/d-7015126/sejarah-dan-arti-semangka-simbol-dukungan-untuk-palestina,02 Nov 2023 11:30 WIB,Sejarah dan Arti Semangka Simbol Dukungan untuk Palestina
https://www.detik.com/sumut/berita/d-7015068/sejarah-semangka-jadi-simbol-dukungan-untuk-palestina,02 Nov 2023 10:59 WIB,Sejarah Semangka Jadi Simbol Dukungan untuk Palestina
https://www.detik.com/sumut/berita/d-7015050/upin-ipin-dukung-palestina-doakan-keselamatan-sahabat,02 Nov 2023 10:54 WIB,"Upin-Ipin Dukung Palestina, Doakan Keselamatan Sahabat"
https://news.detik.com/detiktv/d-7015045/bantuan-kemanusiaan-ri-untuk-gaza-dikirim-akhir-minggu-ini,02 Nov 2023 10:52 WIB,Bantuan Kemanusiaan RI untuk Gaza Dikirim Akhir Minggu Ini
https://news.detik.com/foto-news/d-7014920/rafah-dibuka-warga-asing-mulai-tinggalkan-gaza,02 Nov 2023 10:34 WIB,"Rafah Dibuka, Warga Asing Mulai Tinggalkan Gaza"
https://health.detik.com/berita-detikhealth/d-7015002/cerita-relawan-di-rs-indonesia-di-gaza-ambulans-bolak-balik-bawa-jenazah,02 Nov 2023 10:30 WIB,"Cerita Relawan di RS Indonesia di Gaza, Ambulans Bolak Balik Bawa Jenazah"
https://hot.detik.com/celeb/d-7014968/oki-setiana-dewi-merasa-bersalah-tak-bisa-banyak-bantu-palestina,02 Nov 2023 10:23 WIB,Oki Setiana Dewi Merasa Bersalah Tak Bisa Banyak Bantu Palestina
https://news.detik.com/detiktv/d-7014991/menlu-pastikan-tim-evakuasi-wni-di-gaza-sudah-tiba-di-rafah,02 Nov 2023 10:22 WIB,Menlu Pastikan Tim Evakuasi WNI di Gaza Sudah Tiba di Rafah
https://health.detik.com/detiktv/d-7014989/who-desak-bantuan-kemanusiaan-masuk-di-gaza-dipercepat,02 Nov 2023 10:21 WIB,WHO Desak Bantuan Kemanusiaan Masuk di Gaza Dipercepat
https://hot.detik.com/detiktv/d-7014956/upin-ipin-doakan-keselamatan-sahabat-di-palestina,02 Nov 2023 10:00 WIB,Upin Ipin Doakan Keselamatan Sahabat di Palestina
https://hot.detik.com/celeb/d-7014931/raline-shah-tuhan-tahu-saya-dan-keluarga-support-palestina-sejak-lahir,02 Nov 2023 10:00 WIB,Raline Shah: Tuhan Tahu Saya dan Keluarga Support Palestina Sejak Lahir
https://news.detik.com/detiktv/d-7014934/antrean-pasien-rs-indonesia-di-gaza-seusai-kamp-pengungsi-diserang,02 Nov 2023 09:45 WIB,Antrean Pasien RS Indonesia di Gaza Seusai Kamp Pengungsi Diserang
https://inet.detik.com/science/d-7014862/semangka-jadi-simbol-dukungan-untuk-palestina-begini-sejarahnya,02 Nov 2023 09:11 WIB,"Semangka Jadi Simbol Dukungan untuk Palestina, Begini Sejarahnya"
https://sport.detik.com/sepakbola/liga-inggris/d-7014831/fa-imbau-pemain-tak-pakai-ungkapan-from-river-to-sea-palestine-will-be-free,02 Nov 2023 09:00 WIB,"FA Imbau Pemain Tak Pakai Ungkapan 'From River to Sea, Palestine Will be Free'"
https://news.detik.com/internasional/d-7014858/israel-serang-lagi-kamp-pengungsi-gaza-di-jabalia,02 Nov 2023 08:46 WIB,Israel Serang Lagi Kamp Pengungsi Gaza di Jabalia
https://news.detik.com/internasional/d-7014855/balasan-hamas-hizbullah-houthi-usai-israel-serang-gaza-bertubi-tubi,02 Nov 2023 08:45 WIB,Balasan Hamas-Hizbullah-Houthi Usai Israel Serang Gaza Bertubi-tubi
https://news.detik.com/detiktv/d-7014848/saat-tank-tank-israel-jadi-sasaran-peluru-yasin-105-hamas,02 Nov 2023 08:35 WIB,Saat Tank-tank Israel Jadi Sasaran Peluru 'Yasin 105' Hamas
https://news.detik.com/bbc-world/d-7014839/rafah-dibuka-ratusan-warga-asing-korban-luka-tinggalkan-gaza,02 Nov 2023 08:24 WIB,"Rafah Dibuka, Ratusan Warga Asing-Korban Luka Tinggalkan Gaza"
https://health.detik.com/berita-detikhealth/d-7014782/satu-satunya-rs-kanker-di-gaza-berhenti-beroperasi,02 Nov 2023 07:00 WIB,Satu-satunya RS Kanker di Gaza Berhenti Beroperasi
https://www.detik.com/jabar/berita/d-7013924/honor-syuting-aldi-taher-untuk-palestina,02 Nov 2023 07:00 WIB,Honor Syuting Aldi Taher untuk Palestina
https://sport.detik.com/sepakbola/liga-jerman/d-7014746/noussair-mazraoui-dituntut-pidana-terkait-dukungan-ke-palestina,02 Nov 2023 06:00 WIB,Noussair Mazraoui Dituntut Pidana Terkait Dukungan ke Palestina
https://news.detik.com/detiktv/d-7014740/pernyataan-israel-setelah-menyerang-kamp-pengungsian-jabalia,02 Nov 2023 05:04 WIB,Pernyataan Israel Setelah Menyerang Kamp Pengungsian Jabalia
https://news.detik.com/berita/d-7014648/komisi-i-dpr-bertemu-parlemen-jerman-ajak-suarakan-gencatan-senjata-di-gaza,01 Nov 2023 23:14 WIB,"Komisi I DPR Bertemu Parlemen Jerman, Ajak Suarakan Gencatan Senjata di Gaza"
https://news.detik.com/detiktv/d-7014586/sadis-israel-kembali-bombardir-kamp-pengungsi-gaza-di-jabalia,01 Nov 2023 22:02 WIB,Sadis! Israel Kembali Bombardir Kamp Pengungsi Gaza di Jabalia
https://news.detik.com/berita/d-7014582/ini-rincian-bantuan-yang-akan-dikirim-ri-ke-gaza,01 Nov 2023 21:58 WIB,Ini Rincian Bantuan yang Akan Dikirim RI ke Gaza
https://news.detik.com/detiktv/d-7014580/bantu-palestina-houthi-luncurkan-rudal-drone-ke-israel,01 Nov 2023 21:55 WIB,"Bantu Palestina, Houthi Luncurkan Rudal-Drone ke Israel"
https://health.detik.com/detiktv/d-7014542/pilu-perempuan-di-gaza-terpaksa-minum-pil-penunda-menstruasi,01 Nov 2023 21:15 WIB,Pilu Perempuan di Gaza Terpaksa Minum Pil Penunda Menstruasi
https://hot.detik.com/celeb/d-7013690/beda-ajakan-whulandary-herman-miss-universe-israel-2013-soal-hamas-vs-israel,01 Nov 2023 21:04 WIB,Beda Ajakan Whulandary Herman-Miss Universe Israel 2013 soal Hamas Vs Israel
https://news.detik.com/berita/d-7014523/7-wni-akan-dievakuasi-3-relawan-mer-c-tetap-tinggal-di-gaza,01 Nov 2023 21:03 WIB,"7 WNI Akan Dievakuasi, 3 Relawan MER-C Tetap Tinggal di Gaza"
https://news.detik.com/internasional/d-7014431/direktur-ham-pbb-mundur-karena-gagal-cegah-genosida-di-palestina,01 Nov 2023 20:13 WIB,Direktur HAM PBB Mundur karena Gagal Cegah Genosida di Palestina
https://news.detik.com/berita/d-7014358/rs-indonesia-di-gaza-terancam-lumpuh-menlu-upayakan-masuknya-bahan-bakar,01 Nov 2023 19:32 WIB,"RS Indonesia di Gaza Terancam Lumpuh, Menlu Upayakan Masuknya Bahan Bakar"
https://www.detik.com/jabar/berita/d-7013897/who-wanti-wanti-bencana-kesehatan-di-gaza,01 Nov 2023 19:30 WIB,WHO Wanti-wanti Bencana Kesehatan di Gaza
https://news.detik.com/berita/d-7014244/menlu-retno-bantuan-kemanusiaan-dikirim-ke-gaza-akhir-minggu-ini,01 Nov 2023 18:38 WIB,Menlu Retno: Bantuan Kemanusiaan Dikirim ke Gaza Akhir Minggu Ini
https://www.detik.com/jabar/berita/d-7014015/dipecatnya-sang-model-gegara-bela-palestina,01 Nov 2023 18:30 WIB,Dipecatnya sang Model gegara Bela Palestina
https://finance.detik.com/berita-ekonomi-bisnis/d-7014214/begini-cara-amerika-danai-israel-perang-lawan-hamas,01 Nov 2023 18:30 WIB,Begini Cara Amerika Danai Israel Perang Lawan Hamas
https://www.detik.com/edu/detikpedia/d-7013940/pengertian-genosida-yang-jadi-alasan-petinggi-pbb-mundur-dari-jabatannya,01 Nov 2023 18:30 WIB,Pengertian Genosida yang Jadi Alasan Petinggi PBB Mundur dari Jabatannya
https://news.detik.com/berita/d-7014212/sudah-tiba-di-rafah-tim-evakuasi-wni-dari-gaza-secara-bertahap,01 Nov 2023 18:15 WIB,"Sudah Tiba di Rafah, Tim Evakuasi WNI dari Gaza Secara Bertahap"
https://news.detik.com/berita/d-7014154/menlu-retno-evakuasi-wni-di-gaza-kemungkinan-hari-ini,01 Nov 2023 17:44 WIB,Menlu Retno: Evakuasi WNI di Gaza Kemungkinan Hari Ini
https://news.detik.com/internasional/d-7014120/5-berita-terpopuler-internasional-hari-ini,01 Nov 2023 17:34 WIB,5 Berita Terpopuler Internasional Hari Ini
https://finance.detik.com/bursa-dan-valas/d-7014102/apakah-mata-uang-israel-dan-palestina-sama,01 Nov 2023 17:22 WIB,Apakah Mata Uang Israel dan Palestina Sama?
https://news.detik.com/detiktv/d-7014096/kesaksian-relawan-mer-c-saat-israel-gempur-pasar-di-gaza-dekat-rs-indonesia,01 Nov 2023 17:19 WIB,Kesaksian Relawan MER-C Saat Israel Gempur Pasar di Gaza Dekat RS Indonesia
https://www.detik.com/jabar/berita/d-7014083/bupati-bandung-ajak-masyarakat-berempati-galang-dana-untuk-palestina,01 Nov 2023 17:17 WIB,Bupati Bandung Ajak Masyarakat Berempati-Galang Dana untuk Palestina
https://news.detik.com/detiktv/d-7014070/ketika-kuda-menjadi-yang-paling-berharga-di-gaza,01 Nov 2023 17:12 WIB,Ketika Kuda Menjadi yang Paling Berharga di Gaza
https://www.detik.com/hikmah/foto/d-7013809/potret-warga-gaza-berjuang-hidup-di-tengah-gempuran-bom-israel,01 Nov 2023 16:53 WIB,Potret Warga Gaza Berjuang Hidup di Tengah Gempuran Bom Israel
https://news.detik.com/internasional/d-7013920/bak-neraka-di-bumi-1-anak-tewas-tiap-5-menit-di-gaza-karena-israel,01 Nov 2023 16:28 WIB,"Bak Neraka di Bumi, 1 Anak Tewas Tiap 5 Menit di Gaza karena Israel"
https://news.detik.com/berita/d-7013887/mui-desak-pm-israel-netanyahu-ditetapkan-jadi-penjahat-perang,01 Nov 2023 16:12 WIB,MUI Desak PM Israel Netanyahu Ditetapkan Jadi Penjahat Perang!
https://finance.detik.com/berita-ekonomi-bisnis/d-7013768/ekonomi-di-tepi-barat-lumpuh-warga-palestina-ngeluh-tak-ada-pemasukan,01 Nov 2023 15:20 WIB,"Ekonomi di Tepi Barat Lumpuh, Warga Palestina Ngeluh Tak Ada Pemasukan"
https://news.detik.com/foto-news/d-7013387/momen-kelompok-houthi-yaman-luncurkan-rudal-ke-israel,01 Nov 2023 15:01 WIB,Momen Kelompok Houthi Yaman Luncurkan Rudal ke Israel
https://health.detik.com/berita-detikhealth/d-7013709/rs-gaza-terancam-bom-israel-mesir-bantu-bangun-faskes-sementara-di-perbatasan,01 Nov 2023 15:00 WIB,"RS Gaza Terancam Bom Israel, Mesir Bantu Bangun Faskes Sementara di Perbatasan"
https://hot.detik.com/celeb/d-7013604/aldi-taher-memang-top-transfer-hasil-honor-syuting-untuk-palestina,01 Nov 2023 15:00 WIB,Aldi Taher Memang Top! Transfer Hasil Honor Syuting untuk Palestina
https://hot.detik.com/celeb/d-7013324/selena-gomez-singgung-konflik-mengerikan-di-dunia-berujung-dihujat-netizen,01 Nov 2023 14:45 WIB,"Selena Gomez Singgung Konflik Mengerikan di Dunia, Berujung Dihujat Netizen"
https://finance.detik.com/energi/d-7013575/rakyat-israel-bisa-makmur-meski-tanpa-minyak-ternyata-gara-gara-ini,01 Nov 2023 14:01 WIB,"Rakyat Israel Bisa Makmur Meski Tanpa Minyak, Ternyata Gara-gara Ini!"
https://www.detik.com/jabar/berita/d-7013052/rawat-warga-palestina-yang-terluka-mesir-buka-perbatasan-rafah,01 Nov 2023 13:00 WIB,"Rawat Warga Palestina yang Terluka, Mesir Buka Perbatasan Rafah"
https://hot.detik.com/celeb/d-7013394/whulandary-herman-bela-palestina-adu-debat-dengan-miss-universe-israel-2013,01 Nov 2023 12:34 WIB,"Whulandary Herman Bela Palestina, Adu Debat dengan Miss Universe Israel 2013"
https://news.detik.com/foto-news/d-7013055/kunjungi-perbatasan-rafah-pm-mesir-disambut-demo-pro-palestina,01 Nov 2023 12:31 WIB,"Kunjungi Perbatasan Rafah, PM Mesir Disambut Demo Pro Palestina"
https://www.detik.com/jateng/berita/d-7013092/desak-kemerdekaan-palestina-massa-di-purworejo-gelar-aksi,01 Nov 2023 10:37 WIB,"Desak Kemerdekaan Palestina, Massa di Purworejo Gelar Aksi"
https://news.detik.com/foto-news/d-7012981/brutal-israel-serang-kamp-pengungsi-jabalia-50-orang-tewas,01 Nov 2023 10:31 WIB,"Brutal! Israel Serang Kamp pengungsi Jabalia, 50 Orang Tewas"
https://www.detik.com/hikmah/khazanah/d-7012979/saudi-kutuk-keras-serangan-israel-ke-gaza-anggap-pbb-gagal-tangani-konflik,01 Nov 2023 10:07 WIB,"Saudi Kutuk Keras Serangan Israel ke Gaza, Anggap PBB Gagal Tangani Konflik"
https://finance.detik.com/detiktv/d-7012973/dukung-israel-saham-mcdonalds-hingga-pepsico-menguat,01 Nov 2023 09:37 WIB,"Dukung Israel, Saham McDonald's hingga PepsiCo Menguat"
https://news.detik.com/detiktv/d-7012927/putin-solusi-konflik-di-gaza-adalah-pembentukan-negara-palestina-merdeka,01 Nov 2023 08:55 WIB,Putin: Solusi Konflik di Gaza Adalah Pembentukan Negara Palestina Merdeka
https://health.detik.com/berita-detikhealth/d-7012904/who-sebut-ancaman-kesehatan-mengintai-warga-gaza-di-tengah-blokade-israel,01 Nov 2023 08:32 WIB,WHO Sebut Ancaman Kesehatan Mengintai Warga Gaza di Tengah Blokade Israel
https://news.detik.com/detiktv/d-7012896/tegas-bolivia-putuskan-hubungan-diplomatik-dengan-israel,01 Nov 2023 08:11 WIB,Tegas! Bolivia Putuskan Hubungan Diplomatik dengan Israel
https://www.detik.com/sumut/berita/d-7012886/putin-bicara-solusi-konflik-di-gaza-pembentukan-negara-palestina-merdeka,01 Nov 2023 08:08 WIB,Putin Bicara Solusi Konflik di Gaza: Pembentukan Negara Palestina Merdeka
https://news.detik.com/internasional/d-7012814/putin-tunjuk-hidung-as-bikin-konflik-di-gaza-meluas,01 Nov 2023 06:01 WIB,Putin Tunjuk Hidung AS Bikin Konflik di Gaza Meluas
https://news.detik.com/internasional/d-7012800/kecam-serangan-ke-gaza-bolivia-putuskan-hubungan-diplomatik-dengan-israel,01 Nov 2023 04:56 WIB,"Kecam Serangan ke Gaza, Bolivia Putuskan Hubungan Diplomatik dengan Israel"
https://news.detik.com/internasional/d-7012790/mesir-buka-perbatasan-rafah-akan-tampung-warga-palestina-yang-terluka,01 Nov 2023 03:44 WIB,"Mesir Buka Perbatasan Rafah, Akan Tampung Warga Palestina yang Terluka"
https://www.detik.com/sumut/berita/d-7012723/begini-momen-pertempuran-hamas-vs-israel-di-gaza-utara,31 Okt 2023 23:59 WIB,Begini Momen Pertempuran Hamas Vs Israel di Gaza Utara
https://www.detik.com/sumut/berita/d-7012686/situasi-di-gaza-kini-mengerikan-ratusan-mayat-berserakan-di-jalan,31 Okt 2023 22:34 WIB,"Situasi di Gaza Kini Mengerikan, Ratusan Mayat Berserakan di Jalan"
https://news.detik.com/detiktv/d-7012681/melihat-pertempuran-hamas-vs-israel-di-gaza-utara,31 Okt 2023 22:26 WIB,Melihat Pertempuran Hamas Vs Israel di Gaza Utara
https://news.detik.com/internasional/d-7012571/netanyahu-menentang-gencatan-senjata-malah-ngegas-waktunya-berperang,31 Okt 2023 20:32 WIB,"Netanyahu Menentang Gencatan Senjata, Malah Ngegas Waktunya Berperang"
https://www.detik.com/jabar/berita/d-7011510/mengenal-keffiyeh-dalam-perjuangan-palestina,31 Okt 2023 20:30 WIB,Mengenal Keffiyeh dalam Perjuangan Palestina
https://news.detik.com/detiktv/d-7012556/ngerinya-situasi-di-gaza-ratusan-mayat-berserakan-di-jalan,31 Okt 2023 20:23 WIB,Ngerinya Situasi di Gaza: Ratusan Mayat Berserakan di Jalan
https://news.detik.com/detiktv/d-7012554/umat-kristen-ramai-ramai-berdoa-untuk-warga-gaza,31 Okt 2023 20:19 WIB,Umat Kristen Ramai-ramai Berdoa untuk Warga Gaza
https://www.detik.com/hikmah/foto/d-7012518/potret-muazin-gaza-kumandangkan-azan-di-reruntuhan-masjid,31 Okt 2023 20:00 WIB,Potret Muazin Gaza Kumandangkan Azan di Reruntuhan Masjid
https://www.detik.com/jateng/berita/d-7012371/wujud-simpati-masjid-kampung-di-jatinom-klaten-kibarkan-bendera-palestina,31 Okt 2023 18:35 WIB,"Wujud Simpati, Masjid-Kampung di Jatinom Klaten Kibarkan Bendera Palestina"
https://news.detik.com/foto-news/d-7011556/pbnu-serukan-hentikan-kekerasan-di-gaza,31 Okt 2023 17:26 WIB,PBNU Serukan Hentikan Kekerasan di Gaza
