content_PublishedDate,content_editor,content_site,content_tags,content_title,content_total_words,content_type,url
"3 Januari 2024, 10:46 WIB",unknown,Kompas.com,unknown,Pejabat Senior Hamas Tewas Usai Serangan Drone Israel di Lebanon,unknown,Video,https://video.kompas.com/watch/1135553/pejabat-senior-hamas-tewas-usai-serangan-drone-israel-di-lebanon
"3 Januari 2024, 09:43 WIB",Arini Kusuma Jati,Kompas.com,unknown,Israel Bakal Bela Diri di Kasus Kejahatan Genosida,unknown,Video,https://video.kompas.com/watch/1135421/israel-bakal-bela-diri-di-kasus-kejahatan-genosida
"3 Januari 2024, 08:12 WIB",unknown,Kompas.com,unknown,Momen Militer Israel Temukan Berbagai Senjata Tersembunyi di Sekolah Gaza,unknown,Video,https://video.kompas.com/watch/1135211/momen-militer-israel-temukan-berbagai-senjata-tersembunyi-di-sekolah-gaza
"3 Januari 2024, 08:05 WIB",Anneke Sherina Ramadhani,Kompas.com,unknown,Ribuan Warga Palestina Kembali ke Gaza Utara Usai Israel Tarik Pasukan,unknown,Video,https://video.kompas.com/watch/1135209/ribuan-warga-palestina-kembali-ke-gaza-utara-usai-israel-tarik-pasukan
"3 Januari 2024, 07:17 WIB",Anggie Puspariana,Kompas.com,unknown,"Terperangkap Dalam Perang, Ini yang Dilakukan Warga Gaza di Pengungsian",unknown,Video,https://video.kompas.com/watch/1135175/terperangkap-dalam-perang-ini-yang-dilakukan-warga-gaza-di-pengungsian
"3 Januari 2024, 06:29 WIB",Rizkia Shindy,Kompas.com,unknown,Yaman Bersumpah Akan Balas AS Usai 10 Tentaranya Dibunuh,unknown,Video,https://video.kompas.com/watch/1135166/yaman-bersumpah-akan-balas-as-usai-10-tentaranya-dibunuh
"2 Januari 2024, 21:10 WIB",Anneke Sherina Ramadhani,Kompas.com,unknown,Perang Terus Berkecamuk di Gaza Setelah Israel Janji Tarik Ribuan Pasukannya,unknown,Video,https://video.kompas.com/watch/1134813/perang-terus-berkecamuk-di-gaza-setelah-israel-janji-tarik-ribuan-pasukannya
"2 Januari 2024, 20:58 WIB",Muhammad Dava Arrifa,Kompas.com,unknown,"Militer Israel Klaim Kuasai Kediaman Komandan Hamas, Temukan Senjata dan Data Intelijen",unknown,Video,https://video.kompas.com/watch/1134806/militer-israel-klaim-kuasai-kediaman-komandan-hamas-temukan-senjata-dan-data-intelijen
"2 Januari 2024, 20:23 WIB",Adinda Septia Berliana,Kompas.com,unknown,Militer Israel Klaim Jet Tempurnya Serang Infrastruktur Hizbullah di Lebanon,unknown,Video,https://video.kompas.com/watch/1134696/militer-israel-klaim-jet-tempurnya-serang-infrastruktur-hizbullah-di-lebanon
"2 Januari 2024, 18:25 WIB",Adinda Septia Berliana,Kompas.com,unknown,Israel Digugat Warganya yang Selamat dari Serangan Hamas 7 Oktober 202,unknown,Video,https://video.kompas.com/watch/1134362/israel-digugat-warganya-yang-selamat-dari-serangan-hamas-7-oktober-202
"2 Januari 2024, 17:47 WIB",unknown,Kompas.com,unknown,Palestina Marah Mantan PM Inggris Disebut Ikut Campur Bujuk Negara Barat Terima Warga Gaza,unknown,Video,https://video.kompas.com/watch/1134326/palestina-marah-mantan-pm-inggris-disebut-ikut-campur-bujuk-negara-barat-terima-warga-gaza
"2 Januari 2024, 17:41 WIB",unknown,Kompas.com,unknown,Penampakan Jalur Gaza Usai Israel Umumkan Penarikan Pasukannya,unknown,Video,https://video.kompas.com/watch/1134324/penampakan-jalur-gaza-usai-israel-umumkan-penarikan-pasukannya
"2 Januari 2024, 17:31 WIB",unknown,Kompas.com,unknown,"Juru Nego Houthi ke Teheran, Iran Sanjung Houthi karena Tekadnya Bela Palestina",unknown,Video,https://video.kompas.com/watch/1134221/juru-nego-houthi-ke-teheran-iran-sanjung-houthi-karena-tekadnya-bela-palestina
"2 Januari 2024, 16:47 WIB",unknown,Kompas.com,unknown,Penampakan Langit Gaza yang Lebih Tenang Usai Israel Tarik Pasukan,unknown,Video,https://video.kompas.com/watch/1134118/penampakan-langit-gaza-yang-lebih-tenang-usai-israel-tarik-pasukan
"2 Januari 2024, 16:28 WIB",unknown,Kompas.com,unknown,Iran Tuding AS dan Inggris Bikin Laut Merah Tak Stabil gara-gara Serang Houthi,unknown,Video,https://video.kompas.com/watch/1133992/iran-tuding-as-dan-inggris-bikin-laut-merah-tak-stabil-gara-gara-serang-houthi
"2 Januari 2024, 07:13 WIB",Arini Kusuma Jati,Kompas.com,unknown,"Jumlah Korban Tewas di Gaza Hampir Tembus 22.000 Orang, Warga Kesulitan Dapat Makanan",unknown,Video,https://video.kompas.com/watch/1132584/jumlah-korban-tewas-di-gaza-hampir-tembus-22000-orang-warga-kesulitan-dapat-makanan
"1 Januari 2024, 17:00 WIB",unknown,Kompas.com,unknown,Nestapa Warga Palestina Lewati Pergantian Tahun di Pengungsian Gaza,unknown,Video,https://video.kompas.com/watch/1131789/nestapa-warga-palestina-lewati-pergantian-tahun-di-pengungsian-gaza
"1 Januari 2024, 16:03 WIB",unknown,Kompas.com,unknown,Netanyahu Kecam Afrika Selatan karena Laporkan Israel Terkait Genosida,unknown,Video,https://video.kompas.com/watch/1131586/netanyahu-kecam-afrika-selatan-karena-laporkan-israel-terkait-genosida
"1 Januari 2024, 15:12 WIB",Muhammad Dava Arrifa,Kompas.com,unknown,Serangan Israel Tewaskan Eks Menteri Agama Palestina Youssef Salama,unknown,Video,https://video.kompas.com/watch/1131413/serangan-israel-tewaskan-eks-menteri-agama-palestina-youssef-salama
"1 Januari 2024, 14:16 WIB",Adinda Septia Berliana,Kompas.com,unknown,Palestina Sebut Tak Ada Perdamaian jika Pendudukan Israel Berlanjut,unknown,Video,https://video.kompas.com/watch/1131292/palestina-sebut-tak-ada-perdamaian-jika-pendudukan-israel-berlanjut
"1 Januari 2024, 14:01 WIB",unknown,Kompas.com,unknown,Detik-detik Rentetan Roket Meluncur dari Jalur Gaza ke Israel Usai Tahun Baru,unknown,Video,https://video.kompas.com/watch/1131284/detik-detik-rentetan-roket-meluncur-dari-jalur-gaza-ke-israel-usai-tahun-baru
"1 Januari 2024, 13:31 WIB",Wiyudha Betha Dinaragis,Kompas.com,unknown,"3 Kapalnya Diserang AS, Houthi Tantang Balik Amerika",unknown,Video,https://video.kompas.com/watch/1131204/3-kapalnya-diserang-as-houthi-tantang-balik-amerika
"1 Januari 2024, 12:32 WIB",Adinda Septia Berliana,Kompas.com,unknown,Roket dari Jalur Gaza Dicegat Israel Saat Tengah Malam Jelang Tahun Baru,unknown,Video,https://video.kompas.com/watch/1131075/roket-dari-jalur-gaza-dicegat-israel-saat-tengah-malam-jelang-tahun-baru
"1 Januari 2024, 11:07 WIB",Rizkia Shindy,Kompas.com,unknown,Detik-detik Jet Tempur Israel Hantam Lebanon Selatan,unknown,Video,https://video.kompas.com/watch/1130886/detik-detik-jet-tempur-israel-hantam-lebanon-selatan
2024-01-01 10:11:35,Aditya Jaya Iswara,Kompas.com,"perang israel hamas, perang Hamas vs Israel, Hamas vs Israel terbaru",Serangan Israel Tewaskan Mantan Menteri Palestina - Kompas.com,213,Standard,http://www.kompas.com/global/read/2024/01/01/101135070/serangan-israel-tewaskan-mantan-menteri-palestina
"31 Desember 2023, 22:56 WIB",Rizkia Shindy,Kompas.com,unknown,Jet Tempur Israel Hantam Lebanon Selatan,unknown,Video,https://video.kompas.com/watch/1130517/jet-tempur-israel-hantam-lebanon-selatan
"31 Desember 2023, 17:26 WIB",unknown,Kompas.com,unknown,Netanyahu Sebut Perbatasan Gaza-Mesir Harus di Bawah Kontrol Israel,unknown,Video,https://video.kompas.com/watch/1130092/netanyahu-sebut-perbatasan-gaza-mesir-harus-di-bawah-kontrol-israel
2023-12-31 17:00:00,Rizal Setyo Nugroho,Kompas.com,"Israel, Palestina, bayi, Jalur Gaza, serangan udara israel, Mariam Abu Akel",Bayi di Gaza Ditemukan Selamat Setelah Semalam Terjebak Reruntuhan - Kompas.com,476,Standard,http://www.kompas.com/tren/read/2023/12/31/170000165/bayi-di-gaza-ditemukan-selamat-setelah-semalam-terjebak-reruntuhan
"31 Desember 2023, 16:16 WIB",Novyana Nurmita Dewi,Kompas.com,unknown,"Bersumpah Pulangkan Semua Sandera, Netanyahu Sebut Perang Gaza Terus Berlanjut",unknown,Video,https://video.kompas.com/watch/1129959/bersumpah-pulangkan-semua-sandera-netanyahu-sebut-perang-gaza-terus-berlanjut
"31 Desember 2023, 15:32 WIB",unknown,Kompas.com,unknown,"Israel Batasi Akses ke Masjid Al Aqsa, Jemaah Shalat Jumat di Jalanan",unknown,Video,https://video.kompas.com/watch/1129874/israel-batasi-akses-ke-masjid-al-aqsa-jemaah-shalat-jumat-di-jalanan
2023-12-30 15:29:19,Agung Dwi E,Kompas.com,"dompet dhuafa, Chiki Fawzi",Lelang Karya Chiki Fawzi untuk Palestina Tembus Rp 5 Juta di SOH X Sitapa Fest - Kompas.com,426,Kilas,http://nasional.kompas.com/read/2023/12/30/15291901/lelang-karya-chiki-fawzi-untuk-palestina-tembus-rp-5-juta-di-soh-x-sitapa
"30 Desember 2023, 14:52 WIB",unknown,Kompas.com,unknown,Detik-detik Israel Kembali Hancurkan Terowongan yang Diduga Milik Hamas,unknown,Video,https://video.kompas.com/watch/1128264/detik-detik-israel-kembali-hancurkan-terowongan-yang-diduga-milik-hamas
"30 Desember 2023, 14:42 WIB",Bernadetha Nadia Deni Ananda,Kompas.com,unknown,"Listrik Langka, Penjahit di Gaza Gunakan Tenaga Kerja Manual untuk Operasikan Mesin",unknown,Video,https://video.kompas.com/watch/1128261/listrik-langka-penjahit-di-gaza-gunakan-tenaga-kerja-manual-untuk-operasikan-mesin
"30 Desember 2023, 09:28 WIB",unknown,Kompas.com,unknown,"Israel Kembali Bombardir Rafah, Gaza Bagian Selatan",unknown,Video,https://video.kompas.com/watch/1127681/israel-kembali-bombardir-rafah-gaza-bagian-selatan
"30 Desember 2023, 07:40 WIB",Bernadetha Nadia Deni Ananda,Kompas.com,unknown,Jumlah Anak Palestina yang Tewas di Tepi Barat Meningkat Drastis,unknown,Video,https://video.kompas.com/watch/1127593/jumlah-anak-palestina-yang-tewas-di-tepi-barat-meningkat-drastis
"29 Desember 2023, 23:25 WIB",unknown,Kompas.com,unknown,"Rafah Jadi Target Serangan, Warga Tuding Israel Bohong soal Tempat Aman",unknown,Video,https://video.kompas.com/watch/1127476/rafah-jadi-target-serangan-warga-tuding-israel-bohong-soal-tempat-aman
"29 Desember 2023, 20:36 WIB",Musayadah Khusnul Khotimah,Kompas.com,unknown,Israel Tembaki Kendaraan Konvoi Bantuan di Jalur Gaza,unknown,Video,https://video.kompas.com/watch/1127296/israel-tembaki-kendaraan-konvoi-bantuan-di-jalur-gaza
"29 Desember 2023, 20:25 WIB",Musayadah Khusnul Khotimah,Kompas.com,unknown,PBB Ungkap Tentara Israel Menembaki Konvoi Bantuan Gaza,unknown,Video,https://video.kompas.com/watch/1127212/pbb-ungkap-tentara-israel-menembaki-konvoi-bantuan-gaza
"29 Desember 2023, 18:03 WIB",Bernadetha Nadia Deni Ananda,Kompas.com,unknown,Perang Israel-Hamas Usir 85 Persen Warga Palestina dari Rumah Mereka,unknown,Video,https://video.kompas.com/watch/1126884/perang-israel-hamas-telah-mengusir-85-persen-warga-palestina-dari-rumah-mereka
"29 Desember 2023, 17:30 WIB",Musayadah Khusnul Khotimah,Kompas.com,unknown,Serangan Drone Israel Tewaskan 6 Warga Palestina di Tepi Barat,unknown,Video,https://video.kompas.com/watch/1126781/serangan-drone-israel-tewaskan-6-warga-palestina-di-tepi-barat
"29 Desember 2023, 16:52 WIB",unknown,Kompas.com,unknown,Asap Membubung di Langit Gaza Saat Serangan Israel Berlanjut,unknown,Video,https://video.kompas.com/watch/1126693/asap-membumbung-di-langit-gaza-saat-serangan-israel-berlanjut
"29 Desember 2023, 13:54 WIB",Adinda Septia Berliana,Kompas.com,unknown,2 Jurnalis Palestina Kembali Menjadi Korban Serangan Israel di Gaza,unknown,Video,https://video.kompas.com/watch/1126092/2-jurnalis-palestina-kembali-menjadi-korban-serangan-israel-di-gaza
"29 Desember 2023, 13:16 WIB",Adinda Septia Berliana,Kompas.com,unknown,USS Mason Tembak Jatuh Drone Houthi Yaman,unknown,Video,https://video.kompas.com/watch/1125925/uss-mason-tembak-jatuh-drone-houthi-yaman
"29 Desember 2023, 12:54 WIB",unknown,Kompas.com,unknown,"Tebar Ketakutan, Tank-tank Israel Merangsek Masuk ke Pusat Kota Gaza",unknown,Video,https://video.kompas.com/watch/1125910/tebar-ketakutan-tank-tank-israel-merangsek-masuk-ke-pusat-kota-gaza
"29 Desember 2023, 11:37 WIB",Arini Kusuma Jati,Kompas.com,unknown,"Hilang Kesabaran, Israel Tingkatkan Ancaman ke Hizbullah Lebanon di Tengah Perang Gaza",unknown,Video,https://video.kompas.com/watch/1125808/hilang-kesabaran-israel-tingkatkan-ancaman-ke-hizbullah-lebanon-di-tengah-perang-gaza
"29 Desember 2023, 05:00 WIB",unknown,Kompas.com,unknown,"Jenderalnya Terbunuh dalam Serangan Israel, Iran ""Janji"" Beri Balasan Setimpal",unknown,Video,https://video.kompas.com/watch/1125314/jenderalnya-terbunuh-dalam-serangan-israel-iran-janji-beri-balasan-setimpal
"28 Desember 2023, 22:16 WIB",unknown,Kompas.com,unknown,Tentara Israel Tangkap 21 Orang Terduga Penyedia Dana untuk Hamas,unknown,Video,https://video.kompas.com/watch/1125140/tentara-israel-tangkap-21-orang-terduga-penyedia-dana-untuk-hamas
2023-12-28 21:00:00,Tito Hilmawan Reditya,Kompas.com,"perang hamas israel, update perang hamas israel, Bandara Tersibuk di AS Diblokir Massa Protes Pro-Palestina, bandara jfk, massa pro-palestina",Bandara Tersibuk di AS Diblokir Massa Protes Pro-Palestina - Kompas.com,381,Standard,http://www.kompas.com/global/read/2023/12/28/210000570/bandara-tersibuk-di-as-diblokir-massa-protes-pro-palestina
"28 Desember 2023, 19:48 WIB",Dariz Kartika,Kompas.com,unknown,"Israel Perluas Serangan Darat di Gaza, Ribuan Warga Palestina Melarikan Diri",unknown,Video,https://video.kompas.com/watch/1124909/israel-perluas-serangan-darat-di-gaza-ribuan-warga-palestina-melarikan-diri
"28 Desember 2023, 19:23 WIB",unknown,Kompas.com,unknown,Militer Israel Tangkap 21 Orang Terduga Penyedia Dana untuk Hamas,unknown,Video,https://video.kompas.com/watch/1124780/militer-israel-tangkap-21-orang-terduga-penyedia-dana-untuk-hamas
"28 Desember 2023, 18:25 WIB",Bernadetha Nadia Deni Ananda,Kompas.com,unknown,Hamas Gunakan Roket Termobarik untuk Kali Pertamanya Melawan Israel,unknown,Video,https://video.kompas.com/watch/1124666/hamas-gunakan-roket-termobarik-untuk-kali-pertamanya-melawan-israel
"28 Desember 2023, 18:05 WIB",Bernadetha Nadia Deni Ananda,Kompas.com,unknown,"Jeritan Hati Abu Muhammad Abu Jabal, Pengungsi Palestina yang Terus Terdesak Serangan Israel",unknown,Video,https://video.kompas.com/watch/1124650/jeritan-hati-abu-muhammad-abu-jabal-pengungsi-palestina-yang-terus-terdesak-serangan-israel
"28 Desember 2023, 17:23 WIB",Musayadah Khusnul Khotimah,Kompas.com,unknown,Israel Kirim “Bala Bantuan” ke Gaza Selatan Seiring Meluasnya Pertempuran,unknown,Video,https://video.kompas.com/watch/1124459/israel-kirim-bala-bantuan-ke-gaza-selatan-seiring-meluasnya-pertempuran
"28 Desember 2023, 16:43 WIB",unknown,Kompas.com,unknown,Israel Siapkan Wilayah Timur Gaza jadi Zona Penyangga,unknown,Video,https://video.kompas.com/watch/1124424/israel-siapkan-wilayah-timur-gaza-jadi-zona-penyangga
"28 Desember 2023, 16:17 WIB",unknown,Kompas.com,unknown,Erdogan Sebut Netanyahu Tak Beda dengan Hitler,unknown,Video,https://video.kompas.com/watch/1124262/erdogan-sebut-netanyahu-tak-beda-dengan-hitler
"28 Desember 2023, 16:05 WIB",Bernadetha Nadia Deni Ananda,Kompas.com,unknown,Ribuan Keluarga Palestina Melarikan Diri dari Serangan Darat Israel,unknown,Video,https://video.kompas.com/watch/1124257/ribuan-keluarga-palestina-melarikan-diri-dari-serangan-darat-israel
"28 Desember 2023, 14:46 WIB",unknown,Kompas.com,unknown,Jumlah Warga Palestina yang Tewas Capai 21.000,unknown,Video,https://video.kompas.com/watch/1123997/jumlah-warga-palestina-yang-tewas-capai-21000
"28 Desember 2023, 13:29 WIB",Mochamad Sadheli,Kompas.com,unknown,"PM Palestina: Israel Negara yang Dikutuk Dunia, Tak Akan Pernah Menang",unknown,Video,https://video.kompas.com/watch/1123712/pm-palestina-israel-negara-yang-dikutuk-dunia-tak-akan-pernah-menang
"28 Desember 2023, 13:29 WIB",Anggie Puspariana,Kompas.com,unknown,"Serangan Israel Makin Masif, Warga Palestina Kocar Kacir",unknown,Video,https://video.kompas.com/watch/1123710/serangan-israel-makin-masif-warga-palestina-kocar-kacir
"28 Desember 2023, 13:27 WIB",unknown,Kompas.com,unknown,"Militer Israel Dibayangi Infeksi Jamur Mematikan, Tewaskan Seorang Tentara",unknown,Video,https://video.kompas.com/watch/1123685/militer-israel-dibayangi-infeksi-jamur-mematikan-tewaskan-seorang-tentara
